{
  "schema_version": 1,
  "method": "kinn",
  "mode": "inverse",
  "species": [
    "A",
    "A*",
    "*"
  ],
  "surface_species": [
    "A*",
    "*"
  ],
  "stoichiometry": [
    [
      -1,
      1
    ],
    [
      1,
      -1
    ],
    [
      -1,
      1
    ]
  ],
  "observed_species": [
    "A"
  ],
  "initial_rate_constants": [
    1.5,
    0.7
  ],
  "datasets": [
    {
      "times": [
        0.0,
        0.05,
        0.1,
        0.15,
        0.2,
        0.25,
        0.3,
        0.35,
        0.4,
        0.45,
        0.5,
        0.55,
        0.6,
        0.65,
        0.7,
        0.75,
        0.8,
        0.85,
        0.9,
        0.95,
        1.0
      ],
      "initial_state": [
        0.8,
        0.2,
        0.8
      ],
      "values": [
        [
          0.8
        ],
        [
          0.7512139724139496
        ],
        [
          0.711292816573193
        ],
        [
          0.6783617873724894
        ],
        [
          0.6510161453219669
        ],
        [
          0.6281832154523332
        ],
        [
          0.6090304969423497
        ],
        [
          0.5929028036078995
        ],
        [
          0.5792782443670359
        ],
        [
          0.5677367471596344
        ],
        [
          0.5579371267660834
        ],
        [
          0.5496000927003007
        ],
        [
          0.5424954642204124
        ],
        [
          0.5364324159217826
        ],
        [
          0.5312519405661973
        ],
        [
          0.5268209574941138
        ],
        [
          0.5230276586662277
        ],
        [
          0.5197777970576372
        ],
        [
          0.5169917008462193
        ],
        [
          0.5146018525931707
        ],
        [
          0.5125509126160483
        ]
      ]
    }
  ],
  "surrogate": {
    "layers": [
      16,
      16
    ],
    "activations": "tanh"
  },
  "training": {
    "epochs": 300,
    "steps_per_epoch": 100,
    "warmup_steps": 1000,
    "learning_rate": 0.001,
    "seed": 0,
    "alpha": 100.0,
    "data_tolerance": 0.0005
  },
  "units": {
    "time": "s",
    "bulk": "normalized concentration",
    "surface": "fraction"
  }
}
