{
  "schema_version": 1,
  "method": "rkinn",
  "mode": "forward",
  "species": [
    "A",
    "B",
    "C",
    "A*",
    "B*",
    "C*",
    "D*",
    "E*",
    "F*",
    "*"
  ],
  "surface_species": [
    "A*",
    "B*",
    "C*",
    "D*",
    "E*",
    "F*",
    "*"
  ],
  "stoichiometry": [
    [
      -1,
      1,
      0,
      0,
      0,
      0,
      0,
      0,
      0,
      0,
      0,
      0,
      0,
      0
    ],
    [
      0,
      0,
      -1,
      1,
      0,
      0,
      0,
      0,
      0,
      0,
      0,
      0,
      0,
      0
    ],
    [
      0,
      0,
      0,
      0,
      -1,
      1,
      0,
      0,
      0,
      0,
      0,
      0,
      0,
      0
    ],
    [
      1,
      -1,
      0,
      0,
      0,
      0,
      -1,
      1,
      0,
      0,
      0,
      0,
      0,
      0
    ],
    [
      0,
      0,
      1,
      -1,
      0,
      0,
      0,
      0,
      -1,
      1,
      0,
      0,
      0,
      0
    ],
    [
      0,
      0,
      0,
      0,
      1,
      -1,
      0,
      0,
      0,
      0,
      0,
      0,
      1,
      -1
    ],
    [
      0,
      0,
      0,
      0,
      0,
      0,
      2,
      -2,
      0,
      0,
      -1,
      1,
      0,
      0
    ],
    [
      0,
      0,
      0,
      0,
      0,
      0,
      0,
      0,
      2,
      -2,
      -1,
      1,
      -1,
      1
    ],
    [
      0,
      0,
      0,
      0,
      0,
      0,
      0,
      0,
      0,
      0,
      1,
      -1,
      -1,
      1
    ],
    [
      -1,
      1,
      -1,
      1,
      -1,
      1,
      -1,
      1,
      -1,
      1,
      1,
      -1,
      1,
      -1
    ]
  ],
  "observed_species": [
    "A",
    "B",
    "C"
  ],
  "rate_constants": [
    20.0,
    8.0,
    24.0,
    12.0,
    16.0,
    40.0,
    640.0,
    960.0,
    160.0,
    80.0,
    640.0,
    240.0,
    560.0,
    160.0
  ],
  "datasets": [
    {
      "times": [
        0.0,
        0.001,
        0.002,
        0.003,
        0.004,
        0.005,
        0.006,
        0.007,
        0.008,
        0.009000000000000001,
        0.01,
        0.011,
        0.012,
        0.013000000000000001,
        0.014,
        0.015,
        0.016,
        0.017,
        0.018000000000000002,
        0.019,
        0.02,
        0.021,
        0.022,
        0.023,
        0.024,
        0.025,
        0.026000000000000002,
        0.027,
        0.028,
        0.029,
        0.03,
        0.031,
        0.032,
        0.033,
        0.034,
        0.035,
        0.036000000000000004,
        0.037,
        0.038,
        0.039,
        0.04,
        0.041,
        0.042,
        0.043000000000000003,
        0.044,
        0.045,
        0.046,
        0.047,
        0.048,
        0.049,
        0.05
      ],
      "initial_state": [
        0.6,
        0.4,
        0,
        0,
        0,
        0,
        0,
        0,
        0,
        1
      ]
    }
  ],
  "surrogate": {
    "layers": [
      20,
      20,
      20
    ],
    "activations": [
      "tanh",
      "swish",
      "tanh"
    ]
  },
  "training": {
    "epochs": 300,
    "steps_per_epoch": 100,
    "warmup_steps": 1000,
    "learning_rate": 0.001,
    "seed": 0
  },
  "units": {
    "time": "s",
    "bulk": "normalized concentration",
    "surface": "fraction"
  }
}
