{
  "schema_version": 1,
  "method": "kinn",
  "mode": "forward",
  "species": [
    "A",
    "B"
  ],
  "surface_species": [],
  "stoichiometry": [
    [
      -1,
      1
    ],
    [
      1,
      -1
    ]
  ],
  "observed_species": [
    "A",
    "B"
  ],
  "rate_constants": [
    2.0,
    1.0
  ],
  "datasets": [
    {
      "times": [
        0.0,
        0.05,
        0.1,
        0.15,
        0.2,
        0.25,
        0.3,
        0.35,
        0.4,
        0.45,
        0.5,
        0.55,
        0.6,
        0.65,
        0.7,
        0.75,
        0.8,
        0.85,
        0.9,
        0.95,
        1.0
      ],
      "initial_state": [
        1.0,
        0.0
      ]
    }
  ],
  "surrogate": {
    "layers": [
      16,
      16
    ],
    "activations": "tanh"
  },
  "training": {
    "epochs": 300,
    "steps_per_epoch": 100,
    "warmup_steps": 1000,
    "learning_rate": 0.001,
    "seed": 0
  },
  "units": {
    "time": "s",
    "bulk": "normalized concentration",
    "surface": "fraction"
  }
}
