{
  "schema_version": 1,
  "method": "rkinn",
  "mode": "inverse",
  "species": [
    "A",
    "B"
  ],
  "surface_species": [],
  "stoichiometry": [
    [
      -1,
      1
    ],
    [
      1,
      -1
    ]
  ],
  "observed_species": [
    "A",
    "B"
  ],
  "initial_rate_constants": [
    1.5,
    0.7
  ],
  "datasets": [
    {
      "times": [
        0.0,
        0.05,
        0.1,
        0.15,
        0.2,
        0.25,
        0.3,
        0.35,
        0.4,
        0.45,
        0.5,
        0.55,
        0.6,
        0.65,
        0.7,
        0.75,
        0.8,
        0.85,
        0.9,
        0.95,
        1.0
      ],
      "initial_state": [
        1.0,
        0.0
      ],
      "values": [
        [
          1.0,
          0.0
        ],
        [
          0.9071386509500385,
          0.09286134904996146
        ],
        [
          0.8272121471211452,
          0.17278785287885473
        ],
        [
          0.7584187677478489,
          0.2415812322521511
        ],
        [
          0.6992077573960176,
          0.3007922426039824
        ],
        [
          0.6482443684940098,
          0.3517556315059902
        ],
        [
          0.6043797731603995,
          0.3956202268396005
        ],
        [
          0.5666251660741036,
          0.4333748339258964
        ],
        [
          0.5341294746081346,
          0.4658705253918653
        ],
        [
          0.5061601737639276,
          0.4938398262360723
        ],
        [
          0.4820867734322865,
          0.5179132265677134
        ],
        [
          0.46136660574716937,
          0.5386333942528305
        ],
        [
          0.44353259214772434,
          0.5564674078522756
        ],
        [
          0.42818271439100897,
          0.5718172856089909
        ],
        [
          0.4149709521686546,
          0.5850290478313454
        ],
        [
          0.4035994830412429,
          0.5964005169587571
        ],
        [
          0.3938119688596083,
          0.6061880311403917
        ],
        [
          0.3853877773341021,
          0.6146122226658979
        ],
        [
          0.3781370084931665,
          0.6218629915068334
        ],
        [
          0.37189621391655897,
          0.628103786083441
        ],
        [
          0.36652471224524263,
          0.6334752877547574
        ]
      ]
    }
  ],
  "surrogate": {
    "layers": [
      16,
      16
    ],
    "activations": "tanh"
  },
  "training": {
    "epochs": 300,
    "steps_per_epoch": 100,
    "warmup_steps": 1000,
    "learning_rate": 0.001,
    "seed": 0
  },
  "units": {
    "time": "s",
    "bulk": "normalized concentration",
    "surface": "fraction"
  }
}
